{
  "fixture_version": "0",
  "id": "normalization/empty-messages",
  "family": "normalization",
  "profile": "core-generation",
  "description": "Pending normalization case empty-messages; the oracle records the native outcome.",
  "request": {
    "messages": [],
    "consume": "buffered"
  },
  "route": {
    "targets": [
      "fixture:alpha"
    ],
    "retry": {
      "max_attempts": 1,
      "backoff_base_s": 0,
      "backoff_max_s": 0
    },
    "health_gate": false
  },
  "adapter": {
    "max_repair_attempts": null,
    "models": {
      "alpha": {
        "capabilities": {
          "grammar": false,
          "json_schema": false,
          "json_mode": false
        }
      }
    },
    "health_preset": [],
    "script": [
      {
        "events": [
          {
            "text": "{\"case\":\"empty-messages\"}"
          },
          {
            "final": {
              "finish_reason": "stop"
            }
          }
        ]
      }
    ]
  },
  "expected": {
    "status": "to_be_observed",
    "calls": [],
    "clock_advances_ms": [],
    "telemetry": {
      "repair_attempted": [],
      "parameter_dropped": []
    },
    "events": [],
    "outcome": {
      "none": true
    },
    "accounting": null
  }
}
