{
  "fixture_version": "0",
  "id": "streaming/cancel-mid-stream",
  "family": "streaming",
  "profile": "core-generation",
  "description": "The consumer cancels after three events while the adapter is genuinely suspended after first content.",
  "request": {
    "messages": [
      {
        "role": "user",
        "text": "fixture input"
      }
    ],
    "consume": "stream_cancel_after_events:3"
  },
  "route": {
    "targets": [
      "fixture:alpha"
    ],
    "retry": {
      "max_attempts": 1,
      "backoff_base_s": 0,
      "backoff_max_s": 0
    },
    "health_gate": false
  },
  "adapter": {
    "max_repair_attempts": null,
    "models": {
      "alpha": {
        "grammar": false,
        "json_schema": false,
        "json_mode": false
      },
      "beta": {
        "grammar": false,
        "json_schema": false,
        "json_mode": false
      }
    },
    "health_preset": [],
    "script": [
      {
        "events": [
          {
            "text": "first"
          },
          {
            "await_release": "after-first-content"
          },
          {
            "text": "second"
          },
          {
            "final": {
              "finish_reason": "stop",
              "usage": null
            }
          }
        ]
      }
    ]
  },
  "expected": {
    "status": "to_be_observed",
    "calls": [],
    "clock_advances_ms": [],
    "telemetry": {
      "repair_attempted": [],
      "parameter_dropped": []
    },
    "events": [],
    "outcome": {
      "none": true
    },
    "accounting": null
  }
}
