{
  "fixture_version": "0",
  "id": "routing/health-skip-in-trail",
  "family": "routing",
  "profile": "core-generation",
  "description": "A fresh health record skips alpha and beta receives the request.",
  "request": {
    "messages": [
      {
        "role": "user",
        "text": "fixture input"
      }
    ],
    "consume": "buffered"
  },
  "route": {
    "targets": [
      "fixture:alpha",
      "fixture:beta"
    ],
    "retry": {
      "max_attempts": 1,
      "backoff_base_s": 0,
      "backoff_max_s": 0
    },
    "health_gate": true,
    "health_ttl_s": 60
  },
  "adapter": {
    "max_repair_attempts": null,
    "models": {
      "alpha": {
        "capabilities": {
          "grammar": false,
          "json_schema": false,
          "json_mode": false
        }
      },
      "beta": {
        "capabilities": {
          "grammar": false,
          "json_schema": false,
          "json_mode": false
        }
      }
    },
    "health_preset": [
      {
        "target": "fixture:alpha",
        "failed_at_ms": -1000
      }
    ],
    "script": [
      {
        "events": [
          {
            "text": "beta after health skip"
          },
          {
            "final": {
              "finish_reason": "stop",
              "usage": null
            }
          }
        ]
      }
    ]
  },
  "expected": {
    "status": "observed",
    "calls": [
      {
        "model": "beta",
        "role": "original",
        "mechanism": null,
        "timeout_s": 120.0,
        "max_response_bytes": 1048576,
        "messages": [
          {
            "role": "user",
            "text": "fixture input"
          }
        ]
      }
    ],
    "clock_advances_ms": [],
    "telemetry": {
      "repair_attempted": [],
      "parameter_dropped": []
    },
    "events": [],
    "outcome": {
      "result": {
        "text": "beta after health skip",
        "structured": null,
        "target": {
          "provider_id": "fixture",
          "model": "beta"
        },
        "finish_reason": "stop",
        "usage": {
          "input_tokens": null,
          "output_tokens": null,
          "total_tokens": null,
          "cache_read_tokens": null,
          "cache_write_tokens": null,
          "reasoning_tokens": null
        },
        "timing": {
          "first_token_ms": "non_null",
          "total_ms": "present"
        },
        "structured_mechanism": null,
        "repair_attempts": 0,
        "attempts": [
          {
            "target": "fixture:alpha",
            "outcome": "skipped_unhealthy"
          },
          {
            "target": "fixture:beta",
            "outcome": "ok"
          }
        ],
        "warnings": []
      }
    },
    "accounting": null
  },
  "clock": {
    "start_ms": 0
  }
}
