{
  "fixture_version": "0",
  "id": "normalization/unsupported-alias-target",
  "family": "normalization",
  "profile": "core-generation",
  "description": "Exercises the excluded alias target form.",
  "request": {
    "messages": [
      {
        "role": "user",
        "text": "An alias-shaped target has no provider delimiter."
      }
    ],
    "consume": "buffered"
  },
  "route": {
    "targets": [
      "alpha"
    ],
    "retry": {
      "max_attempts": 1,
      "backoff_base_s": 0,
      "backoff_max_s": 0
    },
    "health_gate": false
  },
  "adapter": {
    "max_repair_attempts": null,
    "models": {
      "alpha": {
        "capabilities": {
          "grammar": false,
          "json_schema": false,
          "json_mode": false
        }
      }
    },
    "health_preset": [],
    "script": [
      {
        "events": [
          {
            "text": "{\"case\":\"alias-target\"}"
          },
          {
            "final": {
              "finish_reason": "stop"
            }
          }
        ]
      }
    ]
  },
  "expected": {
    "status": "observed",
    "calls": [],
    "clock_advances_ms": [],
    "telemetry": {
      "repair_attempted": [],
      "parameter_dropped": []
    },
    "events": [],
    "outcome": {
      "error": {
        "category": "unsupported_input",
        "retryable": false,
        "retry_after_s": null,
        "http_status": null,
        "phase": "generate"
      }
    },
    "accounting": null
  },
  "extension": "targets.alias"
}
