{
  "fixture_version": "0",
  "id": "schema-admission/unsupported-dialect-null",
  "family": "schema-admission",
  "profile": "core-generation",
  "description": "Pending schema-admission case unsupported-dialect-null; the oracle records the native outcome.",
  "request": {
    "messages": [
      {
        "role": "user",
        "text": "Return the scripted JSON response."
      }
    ],
    "schema": {
      "$schema": null,
      "type": "object"
    },
    "consume": "buffered"
  },
  "route": {
    "targets": [
      "fixture:alpha"
    ],
    "retry": {
      "max_attempts": 1,
      "backoff_base_s": 0,
      "backoff_max_s": 0
    },
    "health_gate": false
  },
  "adapter": {
    "max_repair_attempts": null,
    "models": {
      "alpha": {
        "capabilities": {
          "grammar": false,
          "json_schema": false,
          "json_mode": false
        }
      }
    },
    "health_preset": [],
    "script": [
      {
        "events": [
          {
            "text": "{}"
          },
          {
            "final": {
              "finish_reason": "stop"
            }
          }
        ]
      }
    ]
  },
  "expected": {
    "status": "to_be_observed",
    "calls": [],
    "clock_advances_ms": [],
    "telemetry": {
      "repair_attempted": [],
      "parameter_dropped": []
    },
    "events": [],
    "outcome": {
      "none": true
    },
    "accounting": null
  },
  "extension": "schema.other_dialects"
}
