{
  "fixture_version": "0",
  "id": "extraction/empty-response",
  "family": "extraction",
  "profile": "core-generation",
  "description": "Assesses an empty assistant response for structured extraction.",
  "request": {
    "messages": [
      {
        "role": "user",
        "text": "Return the scripted JSON response."
      }
    ],
    "schema": {},
    "consume": "buffered"
  },
  "route": {
    "targets": [
      "fixture:alpha"
    ],
    "retry": {
      "max_attempts": 1,
      "backoff_base_s": 0,
      "backoff_max_s": 0
    },
    "health_gate": false
  },
  "adapter": {
    "max_repair_attempts": null,
    "models": {
      "alpha": {
        "capabilities": {
          "grammar": false,
          "json_schema": false,
          "json_mode": false
        }
      }
    },
    "health_preset": [],
    "script": [
      {
        "events": [
          {
            "text": ""
          },
          {
            "final": {
              "finish_reason": "stop"
            }
          }
        ]
      }
    ]
  },
  "expected": {
    "status": "observed",
    "calls": [
      {
        "model": "alpha",
        "role": "original",
        "mechanism": "prompt",
        "timeout_s": 120.0,
        "max_response_bytes": 1048576,
        "messages": [
          {
            "role": "system",
            "text": [
              "",
              {
                "$schema_prompt": true
              }
            ]
          },
          {
            "role": "user",
            "text": "Return the scripted JSON response."
          }
        ]
      }
    ],
    "clock_advances_ms": [],
    "telemetry": {
      "repair_attempted": [],
      "parameter_dropped": []
    },
    "events": [],
    "outcome": {
      "error": {
        "category": "schema_violation",
        "retryable": false,
        "retry_after_s": null,
        "http_status": null,
        "phase": "validate",
        "issues": [
          {
            "rule": "response_empty",
            "instance_path": null,
            "schema_path": null,
            "params": {}
          }
        ]
      }
    },
    "accounting": null
  }
}
