{
  "fixture_version": "0",
  "id": "routing/post-content-stream-protocol-no-retry",
  "family": "routing",
  "profile": "core-generation",
  "description": "A post-content stream protocol error is fatal.",
  "request": {
    "messages": [
      {
        "role": "user",
        "text": "fixture input"
      }
    ],
    "consume": "buffered"
  },
  "route": {
    "targets": [
      "fixture:alpha"
    ],
    "retry": {
      "max_attempts": 2,
      "backoff_base_s": 0,
      "backoff_max_s": 0
    },
    "health_gate": false
  },
  "adapter": {
    "max_repair_attempts": null,
    "models": {
      "alpha": {
        "capabilities": {
          "grammar": false,
          "json_schema": false,
          "json_mode": false
        }
      },
      "beta": {
        "capabilities": {
          "grammar": false,
          "json_schema": false,
          "json_mode": false
        }
      }
    },
    "health_preset": [],
    "script": [
      {
        "events": [
          {
            "text": "partial"
          }
        ],
        "fail": {
          "category": "stream_protocol",
          "retryable": true,
          "retry_after_s": null,
          "http_status": null,
          "phase": "stream"
        }
      }
    ]
  },
  "expected": {
    "status": "observed",
    "calls": [
      {
        "model": "alpha",
        "role": "original",
        "mechanism": null,
        "timeout_s": 120.0,
        "max_response_bytes": 1048576,
        "messages": [
          {
            "role": "user",
            "text": "fixture input"
          }
        ]
      }
    ],
    "clock_advances_ms": [],
    "telemetry": {
      "repair_attempted": [],
      "parameter_dropped": []
    },
    "events": [],
    "outcome": {
      "error": {
        "category": "stream_protocol",
        "retryable": true,
        "retry_after_s": null,
        "http_status": null,
        "phase": "stream"
      }
    },
    "accounting": null
  }
}
