{
  "fixture_version": "0",
  "id": "streaming/synthesized-usage-update-from-final",
  "family": "streaming",
  "profile": "core-generation",
  "description": "A nonnull final usage arrives without an earlier usage event.",
  "request": {
    "messages": [
      {
        "role": "user",
        "text": "fixture input"
      }
    ],
    "consume": "stream"
  },
  "route": {
    "targets": [
      "fixture:alpha"
    ],
    "retry": {
      "max_attempts": 1,
      "backoff_base_s": 0,
      "backoff_max_s": 0
    },
    "health_gate": false
  },
  "adapter": {
    "max_repair_attempts": null,
    "models": {
      "alpha": {
        "capabilities": {
          "grammar": false,
          "json_schema": false,
          "json_mode": false
        }
      },
      "beta": {
        "capabilities": {
          "grammar": false,
          "json_schema": false,
          "json_mode": false
        }
      }
    },
    "health_preset": [],
    "script": [
      {
        "events": [
          {
            "text": "content"
          },
          {
            "final": {
              "finish_reason": "stop",
              "usage": {
                "input_tokens": 11,
                "output_tokens": 7,
                "total_tokens": 18,
                "cache_read_tokens": 2,
                "cache_write_tokens": 3,
                "reasoning_tokens": 4
              }
            }
          }
        ]
      }
    ]
  },
  "expected": {
    "status": "observed",
    "calls": [
      {
        "model": "alpha",
        "role": "original",
        "mechanism": null,
        "timeout_s": 120.0,
        "max_response_bytes": 1048576,
        "messages": [
          {
            "role": "user",
            "text": "fixture input"
          }
        ]
      }
    ],
    "clock_advances_ms": [],
    "telemetry": {
      "repair_attempted": [],
      "parameter_dropped": []
    },
    "events": [
      {
        "timing_mark": "attempt_start"
      },
      {
        "timing_mark": "first_token"
      },
      {
        "text": "content"
      },
      {
        "usage_update": {
          "input_tokens": 11,
          "output_tokens": 7,
          "total_tokens": 18,
          "cache_read_tokens": 2,
          "cache_write_tokens": 3,
          "reasoning_tokens": 4
        }
      },
      {
        "stream_ended": true
      }
    ],
    "outcome": {
      "result": {
        "text": "content",
        "structured": null,
        "target": {
          "provider_id": "fixture",
          "model": "alpha"
        },
        "finish_reason": "stop",
        "usage": {
          "input_tokens": 11,
          "output_tokens": 7,
          "total_tokens": 18,
          "cache_read_tokens": 2,
          "cache_write_tokens": 3,
          "reasoning_tokens": 4
        },
        "timing": {
          "first_token_ms": "non_null",
          "total_ms": "present"
        },
        "structured_mechanism": null,
        "repair_attempts": 0,
        "attempts": [
          {
            "target": "fixture:alpha",
            "outcome": "ok"
          }
        ],
        "warnings": []
      }
    },
    "accounting": null
  }
}
