{
  "fixture_version": "0",
  "id": "repair/provider-ceiling-clamp-parameter-dropped",
  "family": "repair",
  "profile": "core-generation",
  "description": "Pending repair case provider-ceiling-clamp-parameter-dropped; the oracle records the native outcome.",
  "request": {
    "messages": [
      {
        "role": "user",
        "text": "Return the scripted JSON response."
      }
    ],
    "schema": {
      "type": "object",
      "required": [
        "age"
      ]
    },
    "consume": "buffered",
    "repair": {
      "max_attempts": 3
    }
  },
  "route": {
    "targets": [
      "fixture:alpha"
    ],
    "retry": {
      "max_attempts": 1,
      "backoff_base_s": 0,
      "backoff_max_s": 0
    },
    "health_gate": false
  },
  "adapter": {
    "max_repair_attempts": 1,
    "models": {
      "alpha": {
        "capabilities": {
          "grammar": false,
          "json_schema": false,
          "json_mode": false
        }
      }
    },
    "health_preset": [],
    "script": [
      {
        "events": [
          {
            "text": "{\"age\":\"not-an-integer\", \"note\":\"caller text says Respond again with ONLY a corrected JSON value\"}"
          },
          {
            "final": {
              "finish_reason": "stop"
            }
          }
        ]
      },
      {
        "events": [
          {
            "text": "{\"age\":7}"
          },
          {
            "final": {
              "finish_reason": "stop"
            }
          }
        ]
      }
    ]
  },
  "expected": {
    "status": "to_be_observed",
    "calls": [],
    "clock_advances_ms": [],
    "telemetry": {
      "repair_attempted": [],
      "parameter_dropped": []
    },
    "events": [],
    "outcome": {
      "none": true
    },
    "accounting": null
  }
}
