{
  "fixture_version": "0",
  "id": "extraction/scalar-root-42",
  "family": "extraction",
  "profile": "core-generation",
  "description": "Pending extraction case scalar-root-42; the oracle records the native outcome.",
  "request": {
    "messages": [
      {
        "role": "user",
        "text": "Return the scripted JSON response."
      }
    ],
    "schema": {},
    "consume": "buffered"
  },
  "route": {
    "targets": [
      "fixture:alpha"
    ],
    "retry": {
      "max_attempts": 1,
      "backoff_base_s": 0,
      "backoff_max_s": 0
    },
    "health_gate": false
  },
  "adapter": {
    "max_repair_attempts": null,
    "models": {
      "alpha": {
        "grammar": false,
        "json_schema": false,
        "json_mode": false
      }
    },
    "health_preset": [],
    "script": [
      {
        "events": [
          {
            "text": "42"
          },
          {
            "final": {
              "finish_reason": "stop"
            }
          }
        ]
      }
    ]
  },
  "expected": {
    "status": "to_be_observed",
    "calls": [],
    "clock_advances_ms": [],
    "telemetry": {
      "repair_attempted": [],
      "parameter_dropped": []
    },
    "events": [],
    "outcome": {
      "none": true
    },
    "accounting": null
  }
}
